PROD ID,SUG,ID,SUG MUZAR,SHM MUZAR,MISPAR HEVRA,SHM HEVRA,YITRAT NEHASIM,MENAYOT,AGAH CONC,AGAH MMSL,HALVAAOT LS,KRANOT LS,AHER,MEZUMAN_PIKDONOT,MATAH,HUL
12139-קרנות כלליות-אלטשולר שחם בעמ,פנסיה,12139,קרנות כלליות,אלטשולר שחם פנסיה כללית מסלול בסיסי למקבלי קצבה,513173393,"אלטשולר שחם גמל ופנסיה בע""מ",65.64,13.15,0.002,81.344,0,0,2.337,10.719,4.2,10.82
12140-קרנות כלליות-הראל השקעות בביטוח ושירותים פיננסיים בעמ,פנסיה,12140,קרנות כלליות,הראל פנסיה כללית - בסיסי למקבלי קצבה,512267592,"הראל פנסיה וגמל בע""מ",244.45,34.89,16.129,18.254,12.19,1.067,21.35,7.385,17.61,36.68
12145-קרנות חדשות-שלמה אליהו אחזקות בעמ,פנסיה,12145,קרנות חדשות,מגדל מקפת אישית למקבלי קצבה,512237744,"מגדל מקפת קרנות פנסיה וקופות גמל בע""מ",8277.74,15.19,8.867,62.946,3.96,4.961,0.332,7.461,12.93,19.09
12146-קרנות חדשות-שלמה אליהו אחזקות בעמ,פנסיה,12146,קרנות חדשות,מגדל מקפת אישית הלכה למקבלי קצבה,512237744,"מגדל מקפת קרנות פנסיה וקופות גמל בע""מ",66.57,17.34,12.243,64.694,0,0,-0.045,5.77,13.13,14.8
12147-קרנות חדשות-שלמה אליהו אחזקות בעמ,פנסיה,12147,קרנות חדשות,מגדל מקפת אישית מניות למקבלי קצבה,512237744,"מגדל מקפת קרנות פנסיה וקופות גמל בע""מ",51.64,38.55,0,58.031,0,0.045,-0.487,15.906,13.71,23.72
12148-קרנות חדשות-שלמה אליהו אחזקות בעמ,פנסיה,12148,קרנות חדשות,"מגדל מקפת אישית אג""ח למקבלי קצבה",512237744,"מגדל מקפת קרנות פנסיה וקופות גמל בע""מ",22.93,0,22.479,65.981,5.919,0,-0.048,5.611,4.49,6.64
12152-קרנות כלליות-שלמה אליהו אחזקות בעמ,פנסיה,12152,קרנות כלליות,מגדל מקפת משלימה למקבלי קצבה,512237744,"מגדל מקפת קרנות פנסיה וקופות גמל בע""מ",186.7,19.86,31.53,26.932,9.833,6.342,0.47,10.058,15.06,28.45
12154-קרנות כלליות-מנורה מבטחים החזקות בעמ,פנסיה,12154,קרנות כלליות,מנורה מבטחים משלימה - מקבלי פנסיה חדשים,512245812,"מנורה מבטחים פנסיה וגמל בע""מ",565.36,15.94,29.253,10.164,9.782,9.116,18.506,10.061,13.38,24.08
12155-קרנות חדשות-מנורה מבטחים החזקות בעמ,פנסיה,12155,קרנות חדשות,מנורה מבטחים פנסיה - תיק מקבלי פנסיה חדשים,512245812,"מנורה מבטחים פנסיה וגמל בע""מ",17738.38,17.39,7.964,60.212,5.468,8.352,-0.297,4.258,10.21,21.38
12157-קרנות חדשות-מיטב דש השקעות בעמ,פנסיה,12157,קרנות חדשות,מיטב פנסיה מקיפה מסלול מקבלי קצבה החל מיום 1.1.2018,512065202,"מיטב גמל ופנסיה בע""מ",1750.5,17.08,14.762,59.76,2.688,5.963,0.693,3.861,15.57,22.57
12158-קרנות כלליות-מיטב דש השקעות בעמ,פנסיה,12158,קרנות כלליות,מיטב פנסיה כללית מסלול מקבלי קצבה החל מיום 1.1.2018,512065202,"מיטב גמל ופנסיה בע""מ",68.18,32.98,46.041,15.187,3.519,4.968,1.795,4.725,25.1,40.58
12176-קרנות חדשות-אחר,פנסיה,12176,קרנות חדשות,כלל פנסיה מסלול הלכה למקבלי קצבה,512244146,"כלל פנסיה וגמל בע""מ",50.96,20.71,11.141,61.638,0,0,1.635,4.9,17.4,18.99
12177-קרנות חדשות-אחר,פנסיה,12177,קרנות חדשות,כלל פנסיה מסלול בסיסי למקבלי קצבה,512244146,"כלל פנסיה וגמל בע""מ",6654.88,15.94,6.783,61.633,3.7,8.943,2.486,4.097,17.23,24.61
12251-קרנות כלליות-אחר,פנסיה,12251,קרנות כלליות,כלל פנסיה משלימה- מסלול למקבלי קצבה,512244146,"כלל פנסיה וגמל בע""מ",329.54,34.04,39.048,16.5,3.214,2.123,8.576,4.665,23.12,32.88
12256-קרנות השתלמות-אלטשולר שחם גמל ופנסיה בעמ,גמל,12256,קרנות השתלמות,אלטשולר שחם השתלמות הלכה,513173393,"אלטשולר שחם גמל ופנסיה בע""מ",280.39,49.04,1.943,57.782,1.131,2.9,0.109,18.964,24.34,54.2
12257-קופת גמל להשקעה-אלטשולר שחם גמל ופנסיה בעמ,גמל,12257,קופת גמל להשקעה,אלטשולר שחם חיסכון פלוס הלכה,513173393,"אלטשולר שחם גמל ופנסיה בע""מ",124.13,49.51,2.519,51.172,1.503,3.599,0.412,18.706,24.98,56.25
12419-קרנות חדשות-אלטשולר שחם בעמ,פנסיה,12419,קרנות חדשות,אלטשולר שחם פנסיה מקיפה מניות,513173393,"אלטשולר שחם גמל ופנסיה בע""מ",2978.39,74.43,0.055,51.682,0,2.272,-3.819,17.476,31.99,69.29
12435-קרנות השתלמות-יהב רופאים - חברה לניהול קופות גמל בעמ,גמל,12435,קרנות השתלמות,השתלמות רופאים מניות,510930654,"יחד רופאים - חברה לניהול קופות גמל בע""מ",10.44,90.49,0.764,0,0,0,0.141,8.576,39.47,62.21
12468-תגמולים ואישית לפיצויים-עמי - חברה לניהול קופות גמל ענפיות בעמ,גמל,12468,תגמולים ואישית לפיצויים,"קופת גמל עמ""י  מניות מניות",520042581,"עמ""י - חברה לניהול קופות גמל ענפיות בע""מ",11.2,87.89,8.312,39.385,0,0,3.928,10.039,26.46,70.04
12530-קרנות השתלמות-ילין לפידות ניהול קופות גמל בעמ,גמל,12530,קרנות השתלמות,"ילין לפידות קרן השתלמות מסלול אג""ח עד 15% מניות",513611509,"ילין לפידות ניהול קופות גמל בע""מ",309.25,13.61,37.464,42.742,1.905,1.281,1.722,11.109,19.13,26.23
12531-תגמולים ואישית לפיצויים-אינטרגמל קופות גמל בעמ,גמל,12531,תגמולים ואישית לפיצויים,אלפא מור תגמולים מניות,514956465,"מור גמל ופנסיה בע""מ",3003.12,105.57,5.45,25.898,0.495,9.089,-0.567,21.149,30.41,87.3
12532-תגמולים ואישית לפיצויים-אינטרגמל קופות גמל בעמ,גמל,12532,תגמולים ואישית לפיצויים,אלפא מור תגמולים מדרגות עד 50,514956465,"מור גמל ופנסיה בע""מ",4681.89,61.77,19.274,22.42,5.201,9.469,2.089,17.02,28.5,57.58
12533-תגמולים ואישית לפיצויים-אינטרגמל קופות גמל בעמ,גמל,12533,תגמולים ואישית לפיצויים,אלפא מור תגמולים מדרגות 50-60,514956465,"מור גמל ופנסיה בע""מ",12370.39,47.27,27.342,19.398,9.187,10.276,2.509,13.397,28.33,51.48
12534-תגמולים ואישית לפיצויים-אינטרגמל קופות גמל בעמ,גמל,12534,תגמולים ואישית לפיצויים,אלפא מור תגמולים מדרגות 60 ומעלה,514956465,"מור גמל ופנסיה בע""מ",7536.39,25.75,33.049,19.279,5.603,8.495,2.113,20.929,26.25,34.74
12535-קרנות השתלמות-אינטרגמל קופות גמל בעמ,גמל,12535,קרנות השתלמות,מור השתלמות כללי,514956465,"מור גמל ופנסיה בע""מ",18435.01,44.64,25.401,18.178,8.886,7.945,1.813,21.697,27.01,47.54
12536-קרנות השתלמות-אינטרגמל קופות גמל בעמ,גמל,12536,קרנות השתלמות,מור השתלמות מניות,514956465,"מור גמל ופנסיה בע""מ",5359.47,102.93,4.893,26.852,0.923,6.763,0.124,22.244,29.44,82.96
12537-קופת גמל להשקעה-אינטרגמל קופות גמל בעמ,גמל,12537,קופת גמל להשקעה,מור קופות גמל להשקעה מניות,514956465,"מור גמל ופנסיה בע""מ",2134.29,102.25,5.719,29.358,0.576,5.311,-0.03,23.16,29.18,83.16
12538-קופת גמל להשקעה-אינטרגמל קופות גמל בעמ,גמל,12538,קופת גמל להשקעה,מור קופות גמל להשקעה כללי,514956465,"מור גמל ופנסיה בע""מ",3695.89,45.28,26.924,19.856,8.263,6.047,1.394,21.684,27.05,45.48
"12540-קופת גמל להשקעה-אינפיניטי השתלמות, גמל ופנסיה בעמ",גמל,12540,קופת גמל להשקעה,אינפיניטי גמל להשקעה הלכה,513621110,"אינפיניטי השתלמות, גמל ופנסיה בע""מ",60.83,92.23,0,26.067,0,0,-0.054,15.373,86.56,122.11
12541-תגמולים ואישית לפיצויים-כלל פנסיה וגמל בעמ,גמל,12541,תגמולים ואישית לפיצויים,"כלל תמר אג""ח עד 15% מניות",512244146,"כלל פנסיה וגמל בע""מ",238.48,12.33,54.851,17.566,6.734,5.024,1.055,5.493,14.67,30.22
12599-קרנות השתלמות-כלל פנסיה וגמל בעמ,גמל,12599,קרנות השתלמות,"כלל השתלמות אג""ח עד 15% מניות",512244146,"כלל פנסיה וגמל בע""מ",412.48,12.7,56.422,18.986,3.844,4.374,1.004,5.666,14.76,28.39
12881-פוליסות שהונפקו משנת 2004 ואילך-הפניקס חברה לביטוח אגח בינל,ביטוח,12881,פוליסות שהונפקו משנת 2004 ואילך,"הפניקס חברה לביטוח בע""מ אג""ח בינ""ל",ללא,0,974.83146,0,91.05750444,0.374321116,0,0,2.801417591,7.108757036,95.15,91.99
12882-פוליסות שהונפקו משנת 2004 ואילך-הפניקס חברה לביטוח בעמ מניות חול,ביטוח,12882,פוליסות שהונפקו משנת 2004 ואילך,"הפניקס חברה לביטוח בע""מ מניות חו""ל",ללא,0,315.10845,91.2,0,6.116687763,0,0,0.097268099,50.50534189,90.39,71.18
12895-פוליסות שהונפקו משנת 2004 ואילך-איי. די. איי. מסלול מניות,ביטוח,12895,פוליסות שהונפקו משנת 2004 ואילך,איי. די. איי. מסלול מניות,ללא,0,9.65898,81.63,0,4.799678641,0,0,6.81127821,13.56975581,12.36,56.75
12900-פוליסות שהונפקו משנת 2004 ואילך-איילון מסלול מניות חול מדדי נאסדק; S&P 500,ביטוח,12900,פוליסות שהונפקו משנת 2004 ואילך,"איילון מסלול מניות חו""ל מדדי נאסד""ק; S&P 500",ללא,0,186.52182,97.67,0,0.564169919,0,0,-0.258146741,12.13000173,50.07,97.21
12905-קופת גמל להשקעה-חברת הגמל לעובדי האוניברסיטה העברית בעמ,גמל,12905,קופת גמל להשקעה,קופה להשקעה האוניברסיטה העברית  כללי כללי,510960586,"חברת הגמל לעובדי האוניברסיטה העברית בע""מ",26.91,46.98,17.347,19.143,0.094,0,7.561,12.028,41.06,52.16
12936-פוליסות שהונפקו משנת 2004 ואילך-הכשרה- מור בית השקעות ניהול תיקים בעמ- אגח ממשלת ישראל,ביטוח,12936,פוליסות שהונפקו משנת 2004 ואילך,"הכשרה- מור בית השקעות ניהול תיקים בע""מ- אג""ח ממשלת ישראל",ללא,0,101.11304,0.01,16.65264935,75.09614981,0.815424005,0.5397919,0,6.890110316,4.39,5.72
12937-פוליסות שהונפקו משנת 2004 ואילך-הכשרה- מור בית השקעות ניהול תיקים בעמ- כללי,ביטוח,12937,פוליסות שהונפקו משנת 2004 ואילך,"הכשרה- מור בית השקעות ניהול תיקים בע""מ- כללי",ללא,0,916.95433,42.45,27.94802223,30.04030746,2.722153022,0.537453158,4.488446006,12.87495965,22.05,37.11
12938-פוליסות שהונפקו משנת 2004 ואילך-הכשרה- מור בית השקעות ניהול תיקים בעמ- מניות,ביטוח,12938,פוליסות שהונפקו משנת 2004 ואילך,"הכשרה- מור בית השקעות ניהול תיקים בע""מ- מניות",ללא,0,177.1085,95.1,11.19217881,14.5368517,0,0.574788901,8.695178379,14.92000666,34.47,71.72
12955-קופת גמל להשקעה-מור גמל ופנסיה בעמ,גמל,12955,קופת גמל להשקעה,"מור קופת גמל להשקעה אג""ח עד 25% במניות",514956465,"מור גמל ופנסיה בע""מ",354.55,23.62,42.409,27.447,3.834,4.772,1.346,10.895,25.55,30.86
12956-קרנות השתלמות-מור גמל ופנסיה בעמ,גמל,12956,קרנות השתלמות,"מור השתלמות אג""ח עד 25% במניות",514956465,"מור גמל ופנסיה בע""מ",1229.15,24.08,39.503,27.348,3.046,5.184,1.522,14.092,24,30.44
12957-תגמולים ואישית לפיצויים-מור גמל ופנסיה בעמ,גמל,12957,תגמולים ואישית לפיצויים,"אלפא מור תגמולים אג""ח עד 25% במניות",514956465,"מור גמל ופנסיה בע""מ",642.12,23.91,41.277,27.989,4.366,6.929,1.285,7.846,25.93,32.06
12966-קרנות חדשות-מיטב דש השקעות בעמ,פנסיה,12966,קרנות חדשות,מיטב פנסיה מקיפה הלכה למקבלי קצבה,512065202,"מיטב גמל ופנסיה בע""מ",41.55,20.07,0,90.409,0,0,0.118,9.309,6.91,12.9
12981-פוליסות שהונפקו משנת 2004 ואילך-הראל מסלול הוני ללא אגח,ביטוח,12981,פוליסות שהונפקו משנת 2004 ואילך,"הראל מסלול הוני ללא אג""ח",ללא,0,220.28656,63.04,0,5.143209826,0,30.19062988,1.120767422,17.09378003,31.15,86.03
13029-פוליסות שהונפקו משנת 2004 ואילך-מנורה מבטחים ביטוח בעמ 20/80,ביטוח,13029,פוליסות שהונפקו משנת 2004 ואילך,"מנורה מבטחים ביטוח בע""מ 20/80",ללא,0,92.20631,19.39,41.1708266,29.29203001,8.493128073,0,-0.146953066,5.872700035,16.39,22.51
13188-תגמולים ואישית לפיצויים-שיבולת - חברה לניהול קופות גמל בעמ,גמל,13188,תגמולים ואישית לפיצויים,שיבולת-תגמולים מניות מניות,520030693,"שיבולת - חברה לניהול קופות גמל בע""מ",46.52,87.45,0,0,0,1.072,0.233,11.243,32,56.95
13209-קופת גמל להשקעה-הפניקס אקסלנס פנסיה וגמל בעמ,גמל,13209,קופת גמל להשקעה,הפניקס גמל להשקעה שיקלי טווח קצר,513026484,"הפניקס פנסיה וגמל בע""מ",48,0,23.422,74.046,1.144,0,-0.096,1.484,0,0.77
13211-קרנות כלליות-אלטשולר שחם בעמ,פנסיה,13211,קרנות כלליות,אלטשולר שחם פנסיה כללית מניות,513173393,"אלטשולר שחם גמל ופנסיה בע""מ",119.42,99.28,0.034,45.841,0,1.239,-8.403,18.804,43.74,92.04
13212-קרנות כלליות-אלטשולר שחם בעמ,פנסיה,13212,קרנות כלליות,"אלטשולר שחם פנסיה כללית ""הלכה""",513173393,"אלטשולר שחם גמל ופנסיה בע""מ",2.51,50.47,11.743,30.479,0,0,-9.464,16.791,23.56,46.64
13213-קרנות חדשות-אחר,פנסיה,13213,קרנות חדשות,כלל פנסיה שיקלי טווח קצר,512244146,"כלל פנסיה וגמל בע""מ",142.18,0,48.653,32.453,0,0,-0.454,19.348,0,0
13214-קרנות כלליות-אחר,פנסיה,13214,קרנות כלליות,כלל פנסיה משלימה שקלי טווח קצר,512244146,"כלל פנסיה וגמל בע""מ",12.21,0,61.472,21.061,0,0,-0.074,17.541,0,0
13226-קרנות כלליות-אחר,פנסיה,13226,קרנות כלליות,"כלל פנסיה משלימה מסלול למקבלי קצבה   אג""ח עד 20% מניות",512244146,"כלל פנסיה וגמל בע""מ",16.72,17.57,49.895,29.681,0,0.056,0.346,6.834,17.42,22.97
"13228-קופת גמל להשקעה-אינפיניטי השתלמות, גמל ופנסיה בעמ",גמל,13228,קופת גמל להשקעה,אינפיניטי גמל להשקעה פאסיבי כללי,513621110,"אינפיניטי השתלמות, גמל ופנסיה בע""מ",12.61,49.48,37.675,9.048,0,0,-0.039,3.835,19.48,32.4
"13229-קרנות השתלמות-אינפיניטי השתלמות, גמל ופנסיה בעמ",גמל,13229,קרנות השתלמות,אינפיניטי השתלמות  כללי,513621110,"אינפיניטי השתלמות, גמל ופנסיה בע""מ",81.55,45.66,22.235,22.536,5.814,0,-0.041,4.269,20.48,31.73
13231-קרנות השתלמות-החברה המנהלת של רום קרן ההשתלמות לעובדי הרשויות המקומיות בעמ,גמל,13231,קרנות השתלמות,רום  מסלול הלכה,520031824,"החברה המנהלת של רום קרן ההשתלמות לעובדי הרשויות המקומיות בע""מ",25.16,43.07,7.994,68.911,0,0,-0.003,6.604,23.17,34.66
13244-פוליסות שהונפקו משנת 2004 ואילך-כלל חברה לביטוח בעמ שיקלי טווח קצר,ביטוח,13244,פוליסות שהונפקו משנת 2004 ואילך,"כלל חברה לביטוח בע""מ שיקלי טווח קצר",ללא,0,259.07984,0,60.40466136,24.53189719,0.134089939,0,0,14.92933607,0,0
13245-קרנות השתלמות-מיטב גמל ופנסיה בעמ,גמל,13245,קרנות השתלמות,מיטב השתלמות מחקה מדד S&amp;P500,512065202,"מיטב גמל ופנסיה בע""מ",2327.93,98.61,0,67.786,0,0,-4.416,17.879,98.82,98.54
13246-תגמולים ואישית לפיצויים-מיטב גמל ופנסיה בעמ,גמל,13246,תגמולים ואישית לפיצויים,מיטב גמל מחקה מדד S&amp;P500,512065202,"מיטב גמל ופנסיה בע""מ",1377.42,98.76,0,67.887,0,0,-4.44,17.778,98.96,97.93
13250-קופת גמל להשקעה-הפניקס אקסלנס פנסיה וגמל בעמ,גמל,13250,קופת גמל להשקעה,הפניקס גמל להשקעה מחקה מדד S&amp;P500,513026484,"הפניקס פנסיה וגמל בע""מ",2113.94,96.79,0,0,0.031,0,-30.419,75.118,96.2,97.58
13254-קופת גמל להשקעה-הראל פנסיה וגמל בעמ,גמל,13254,קופת גמל להשקעה,הראל גמל להשקעה שיקלי טווח קצר,512267592,"הראל פנסיה וגמל בע""מ",38.65,0,0,99.503,0,0,0.048,0.449,0,0
13259-קופת גמל להשקעה-מיטב גמל ופנסיה בעמ,גמל,13259,קופת גמל להשקעה,מיטב גמל להשקעה מחקה מדד S&amp;P 500,512065202,"מיטב גמל ופנסיה בע""מ",779.51,98.97,0,68.031,0,0,-4.474,17.626,99.17,98.77
13260-קרנות חדשות-מיטב דש השקעות בעמ,פנסיה,13260,קרנות חדשות,מיטב פנסיה מקיפה מחקה מדד S1;P 500,512065202,"מיטב גמל ופנסיה בע""מ",3742.89,70.44,0,75.943,0,0,-3.134,13.799,70.58,71.09
13263-תגמולים ואישית לפיצויים-הפניקס אקסלנס פנסיה וגמל בעמ,גמל,13263,תגמולים ואישית לפיצויים,הפניקס גמל מחקה מדד s&amp;p500,513026484,"הפניקס פנסיה וגמל בע""מ",4185.18,96.93,0,0,0.014,0,-30.458,75.091,96.35,97.93
13264-קרנות השתלמות-הפניקס אקסלנס פנסיה וגמל בעמ,גמל,13264,קרנות השתלמות,הפניקס השתלמות מחקה מדד s&amp;p500,513026484,"הפניקס פנסיה וגמל בע""מ",6691.67,97,0,0,0.001,0,-30.462,75.069,96.46,97.55
13278-קרנות כלליות-הראל השקעות בביטוח ושירותים פיננסיים בעמ,פנסיה,13278,קרנות כלליות,הראל פנסיה כללית מניות מניות,512267592,"הראל פנסיה וגמל בע""מ",275.85,96.58,0.003,16.434,0,0.335,1.762,13.484,31.58,74.76
13279-קרנות כלליות-הראל השקעות בביטוח ושירותים פיננסיים בעמ,פנסיה,13279,קרנות כלליות,הראל פנסיה כללית שיקלי טווח קצר,512267592,"הראל פנסיה וגמל בע""מ",9.17,0,0,85.267,0,0,-2.528,17.261,0,0
13285-קרנות כלליות-מיטב דש השקעות בעמ,פנסיה,13285,קרנות כלליות,מיטב פנסיה כללית מחקה מדד S1;P500,512065202,"מיטב גמל ופנסיה בע""מ",286.11,98.93,0,68.002,0,0,-4.391,17.58,99.13,98.69
13286-קרנות כלליות-מיטב דש השקעות בעמ,פנסיה,13286,קרנות כלליות,מיטב פנסיה כללית הלכה למקבלי קצבה,512065202,"מיטב גמל ופנסיה בע""מ",0.32,35.04,0,90.337,0,0,-0.041,9.35,8.74,29.82
13303-קרנות חדשות-מנורה מבטחים החזקות בעמ,פנסיה,13303,קרנות חדשות,מנורה מבטחים פנסיה יעד לפרישה 2065,512245812,"מנורה מבטחים פנסיה וגמל בע""מ",875.13,53.04,10.456,29.303,2.535,1.855,0.039,13.177,25.13,40.83
13307-קרנות כלליות-מנורה מבטחים החזקות בעמ,פנסיה,13307,קרנות כלליות,מנורה מבטחים משלימה יעד לפרישה 2065,512245812,"מנורה מבטחים פנסיה וגמל בע""מ",23.19,53.93,30.039,8.81,0,0,-0.653,18.781,26.51,43.69
13335-קרנות חדשות-הפניקס אחזקות בעמ,פנסיה,13335,קרנות חדשות,הפניקס פנסיה מקיפה מסלול מחקה מדד S1;P500,513026484,"הפניקס פנסיה וגמל בע""מ",10147.41,70.25,0,25.577,0,0,-1.673,56.332,69.82,70.84
13342-קרנות השתלמות-כלל פנסיה וגמל בעמ,גמל,13342,קרנות השתלמות,כלל השתלמות עוקב  מדד s&amp;p 500,512244146,"כלל פנסיה וגמל בע""מ",1958.53,97.94,0,0,0.101,0,-0.28,45.701,99.51,108.39
13343-תגמולים ואישית לפיצויים-כלל פנסיה וגמל בעמ,גמל,13343,תגמולים ואישית לפיצויים,כלל תמר מחקה מדד s&amp;p 500,512244146,"כלל פנסיה וגמל בע""מ",930.89,98,0,0,0.101,0,-0.286,45.673,99.57,108.89
13344-קופת גמל להשקעה-כלל פנסיה וגמל בעמ,גמל,13344,קופת גמל להשקעה,כלל גמל לעתיד עוקב  מדד s&amp;p 500,512244146,"כלל פנסיה וגמל בע""מ",475.97,98.17,0,0,0.101,0,-0.316,45.615,99.74,108.95
1-פוליסות שהונפקו משנת 2004 ואילך-איי. די. איי. חברה לביטוח בעמ מסלול אגח ממשלת ישראל,ביטוח,13346,פוליסות שהונפקו משנת 2004 ואילך,"כלל חברה לביטוח בע""מ מחקה מדד S&P500",ללא,0,1269.249,98.4,0,0,0,0,-0.266181025,47.23809119,99.98,109.17
13347-קרנות חדשות-אחר,פנסיה,13347,קרנות חדשות,כלל פנסיה מחקה מדד s1;p 500,512244146,"כלל פנסיה וגמל בע""מ",5214.76,73.47,0,24.822,0,0,0.356,33.954,74.65,78.7
13349-קרנות חדשות-מנורה מבטחים החזקות בעמ,פנסיה,13349,קרנות חדשות,"מנורה מבטחים פנסיה חו""ל",512245812,"מנורה מבטחים פנסיה וגמל בע""מ",264.05,18.33,23.278,50.329,0,0,-0.003,13.293,64.51,67.31
13350-קרנות חדשות-מנורה מבטחים החזקות בעמ,פנסיה,13350,קרנות חדשות,"מנורה מבטחים פנסיה מדדי מניות חו""ל - פאסיבי",512245812,"מנורה מבטחים פנסיה וגמל בע""מ",2448.67,72.58,0,23.874,0,0,-0.014,3.56,54.76,72.34
13351-קרנות כלליות-מנורה מבטחים החזקות בעמ,פנסיה,13351,קרנות כלליות,"מנורה מבטחים משלימה חו""ל",512245812,"מנורה מבטחים פנסיה וגמל בע""מ",20.59,24.49,23.407,46.232,0,0,-0.697,13.564,89.63,94.79
13352-קרנות כלליות-מנורה מבטחים החזקות בעמ,פנסיה,13352,קרנות כלליות,"מנורה מבטחים משלימה מדדי מניות חו""ל - פאסיבי",512245812,"מנורה מבטחים פנסיה וגמל בע""מ",232.72,99.89,0,0,0,0,-0.615,0.724,75.37,99.16
13353-קופת גמל להשקעה-מנורה מבטחים פנסיה וגמל בעמ,גמל,13353,קופת גמל להשקעה,"מנורה מבטחים גמל להשקעה מדדי מניות חו""ל - פאסיבי",512245812,"מנורה מבטחים פנסיה וגמל בע""מ",119.58,98.33,0,0,0,0,-0.069,1.735,74.19,98.67
13354-קופת גמל להשקעה-מנורה מבטחים פנסיה וגמל בעמ,גמל,13354,קופת גמל להשקעה,"מנורה מבטחים גמל להשקעה חו""ל",512245812,"מנורה מבטחים פנסיה וגמל בע""מ",53.06,23.69,24.593,47.63,0,0,-0.011,10.867,91.58,93.89
13355-תגמולים ואישית לפיצויים-מנורה מבטחים פנסיה וגמל בעמ,גמל,13355,תגמולים ואישית לפיצויים,"מנורה מבטחים תגמולים חו""ל",512245812,"מנורה מבטחים פנסיה וגמל בע""מ",287.23,23.04,24.124,46.733,0,0,-0.015,12.695,90.05,92.45
13356-תגמולים ואישית לפיצויים-מנורה מבטחים פנסיה וגמל בעמ,גמל,13356,תגמולים ואישית לפיצויים,"מנורה מבטחים תגמולים מדדי מניות חו""ל - פאסיבי",512245812,"מנורה מבטחים פנסיה וגמל בע""מ",299.87,96.83,0,0,0,0,-0.066,3.239,73.06,97.28
13357-קרנות השתלמות-מנורה מבטחים פנסיה וגמל בעמ,גמל,13357,קרנות השתלמות,"מנורה מבטחים השתלמות חו""ל",512245812,"מנורה מבטחים פנסיה וגמל בע""מ",324.06,24.21,24.19,46.625,0,0,-0.009,11.898,90.53,92.19
